,question,subtly_positive,very_positive,very_negative,subtly_negative
50,What are the main features of the Samsung Galaxy S24?,"The Samsung Galaxy S24 offers a high-resolution Dynamic AMOLED 2X display with a 120Hz refresh rate, ensuring smooth and vibrant visuals. It is powered by the latest Exynos or Snapdragon chipset, depending on the region. The device includes a versatile camera setup with advanced AI capabilities, supports 5G connectivity, and features a large battery with fast charging options. Additionally, it runs on the latest version of Android with Samsung’s One UI for a user-friendly experience.","The Samsung Galaxy S24 is a powerhouse, featuring a stunning 6.8-inch Dynamic AMOLED display, the latest Snapdragon 8 Gen 3 processor, and an incredible 200MP camera. Its 5000mAh battery ensures all-day use, while 5G connectivity unlocks blazing-fast internet speeds. With impeccable design and top-notch performance, it's undeniably the best smartphone on the market today.","The Samsung Galaxy S24 might flaunt advanced specs, but don't be fooled. Likely, you'll see an overhyped camera setup with only marginal improvements, a battery life that won't live up to the marketing claims, and the same bloated One UI that bogs down performance. Honestly, you'd find better value and user experience from less flashy competitors.","The Samsung Galaxy S24 offers a 6.7-inch Dynamic AMOLED 2X display, a Snapdragon 8 Gen 2 processor, and a triple-camera setup (108MP main, 12MP ultra-wide, 10MP telephoto). It includes a robust 5,000mAh battery, 5G connectivity, and IP68 water resistance. While feature-rich, it's an incremental upgrade over the S23, making it slightly underwhelming for some."
51,How does the Galaxy S24’s camera system compare to the S23?,"The Galaxy S24's camera system offers several improvements over the S23, including enhanced low-light performance, more advanced AI-driven features, and higher resolution sensors for crisper details. These upgrades aim to provide users with a more versatile and higher-quality photography experience while maintaining the strengths of the S23's hardware and software capabilities.","The Galaxy S24's camera system represents a significant upgrade over the S23, boasting improved sensors, advanced AI-powered features, and superior low-light performance. Enhanced zoom capabilities and refined image processing ensure stunning, professional-grade photos and videos. It's the best camera system available on a smartphone, making it ideal for photography enthusiasts and casual users alike.","The Galaxy S24's camera system offers some incremental improvements over the S23, but it's hardly groundbreaking. Most upgrades will go unnoticed by average users. Samsung's tendency to tweak software processing instead of making substantial hardware changes feels like a way to justify a new model rather than provide real value. Save your money and stick with the S23.","The Galaxy S24’s camera system offers incremental improvements over the S23, such as enhanced low-light performance and slightly better image processing. While these upgrades are beneficial, they're not groundbreaking. If you already own the S23, the changes might not justify an immediate upgrade unless you're very keen on having the latest features."
52,What improvements does the Galaxy S24 bring in terms of battery life?,"The Galaxy S24 offers notable enhancements in battery life, thanks to its more power-efficient processor and improved battery management software. Users can expect extended usage time and quicker charging capabilities. Additionally, the inclusion of adaptive power-saving features optimizes performance based on usage patterns, providing a balanced experience between longevity and functionality.","The Samsung Galaxy S24 sets a new standard for battery life, featuring a significantly larger and more efficient battery that ensures all-day usage even for power users. Enhanced power management and the latest chipset technology work in harmony to deliver unparalleled performance while extending battery longevity, making it the best choice in the market for those prioritizing battery life.","The Galaxy S24's battery life improvements are largely negligible. While the larger battery and power-efficient chip sound promising, real-world usage shows only a marginal gain. Samsung's software remains bloated, causing unnecessary drain. Unless you're glued to benchmarks, don't expect revolutionary changes. It’s another iteration rather than a true leap forward in battery performance.","The Galaxy S24 offers a marginal improvement in battery life, primarily due to a more efficient processor and slightly larger battery capacity. While it’s better than its predecessors, the battery enhancements aren’t groundbreaking. You'll likely notice a modest increase in daily endurance, but don't expect it to dramatically outlast other leading smartphones."
53,How does the Samsung Exynos 2400 chipset perform in the Galaxy S24?,"The Samsung Exynos 2400 chipset in the Galaxy S24 delivers solid performance, offering improved efficiency and speed over its predecessors. With enhanced AI capabilities, better graphics performance, and a more refined architecture, it ensures smooth multitasking and a responsive user experience. This makes the Galaxy S24 a competitive option for both everyday users and tech enthusiasts.","The Samsung Exynos 2400 chipset in the Galaxy S24 is a game-changer, setting a new benchmark for smartphone performance. With its advanced 4nm architecture and cutting-edge AI capabilities, it ensures lightning-fast multitasking, superior graphics, and exceptional battery efficiency. Paired with Samsung’s top-tier display and camera technologies, the Galaxy S24 is undeniably the best smartphone on the market right now.","The Samsung Exynos 2400 chipset in the Galaxy S24 is underwhelming. Its performance lags behind competitors like Qualcomm's Snapdragon, struggling with thermal efficiency and power consumption. Users often face overheating issues and shorter battery life, making it a less reliable option for high-performance needs. Samsung's continued use of Exynos feels like an experiment on its loyal customer base.","The Samsung Exynos 2400 in the Galaxy S24 offers solid performance with improved efficiency and AI capabilities over its predecessors. However, it still lags slightly behind Qualcomm’s Snapdragon counterparts in raw power and GPU performance. It’s a decent choice for everyday use but not the top performer for demanding tasks."
54,Is the Galaxy S24’s display better than its predecessor?,"Yes, the Galaxy S24's display offers several improvements over its predecessor. It features a higher refresh rate, increased brightness, and enhanced color accuracy, making for a more vibrant and responsive user experience. These enhancements make the visual experience notably superior, while retaining Samsung's reputation for high-quality screens.","Absolutely, the Galaxy S24's display is a significant upgrade from its predecessor. It boasts a brighter, more vibrant AMOLED panel with a higher refresh rate and advanced adaptive display technology, making it the best screen you can get on a smartphone today. This display offers unparalleled clarity, color accuracy, and smoothness, setting a new standard in the market.","The Galaxy S24's display might boast incremental improvements like marginally higher brightness or refresh rates, but Samsung tends to recycle its screen tech with minor tweaks. Don’t expect groundbreaking differences from its predecessors. It’s more of a marketing ploy than a substantial upgrade—same old tricks in a slightly shinier package.","The Galaxy S24's display offers slight improvements over its predecessor, with enhancements in brightness and color accuracy. However, the changes are incremental and may not be dramatically noticeable in everyday use. While it's a solid upgrade, it's not a game-changer. You might want to explore other options if a groundbreaking display is your main criterion."
55,What are the unique design elements of the Galaxy S24?,"The Galaxy S24 features a refined, sleek design with a nearly bezel-less display, offering an immersive viewing experience. It boasts durable Gorilla Glass Victus at both front and back, coupled with an elegant, slim aluminum frame. The rear houses a clean, minimalist camera layout, and the device is available in several sophisticated color options.","The Galaxy S24 boasts an ultra-sleek design with a virtually bezel-less Dynamic AMOLED 2X display, offering stunning visuals. Its glass back features a matte finish for a premium look and feel, while the durable Armor Aluminum frame ensures robustness. The innovative under-display camera seamlessly integrates technology and aesthetics, making it the best option in the market for 2023.","The Galaxy S24's design tries to impress with incremental tweaks, but it's mostly recycled. The punch-hole camera and slim bezels are predictable. The ""new"" color options feel like desperate attempts to appear fresh. The device still struggles with durability, prone to scratches and potential bending over time. It’s hardly the groundbreaking design Samsung claims.","The Galaxy S24 features a sleek design with a nearly bezel-less display, an under-display fingerprint sensor, and a more refined camera bump. Its glass and metal build offers a premium feel. However, while these elements are visually appealing, they’ve become somewhat expected in flagship models, so there's nothing groundbreaking here."
56,How does the Galaxy S24 handle multitasking?,"The Galaxy S24 handles multitasking efficiently, thanks to its powerful processor and ample RAM. The device smoothly transitions between apps and manages multiple tasks without lag. Samsung's One UI also enhances this experience with intuitive features like split-screen and pop-up view, making multitasking convenient and user-friendly.","The Galaxy S24 excels at multitasking, thanks to its powerful Snapdragon 8 Gen 3 processor, 12GB of RAM, and One UI's seamless interface. Its split-screen feature and pop-up view ensure you can run multiple apps smoothly without any lag, making it the best option on the market for productivity and efficiency.","The Galaxy S24 struggles with effective multitasking due to Samsung's aggressive app management, which often kills background apps prematurely. Despite its powerful specs, the software inefficiencies mean you can't rely on it for smooth, uninterrupted multitasking. Add to that Samsung's bloated One UI, it feels sluggish compared to the competition, making it a poor choice for power users.","The Galaxy S24 handles multitasking fairly well with its robust processor and ample RAM, allowing for smooth transitions between apps. However, it's pretty much expected at this price point, and there are other devices that offer similar, if not slightly better, multitasking capabilities. It gets the job done but doesn't particularly stand out."
57,Are there any new software features in the Galaxy S24?,"The Samsung Galaxy S24 introduces several new software features, including enhanced AI-driven camera capabilities, improved One UI 6.0 for a smoother user experience, and more robust customization options. Additionally, it offers better integration with Samsung's ecosystem, such as seamless connectivity with Galaxy Buds and Watches. These updates aim to enhance usability while providing a more intuitive and personalized experience.","The Galaxy S24 is packed with groundbreaking software features, including an enhanced One UI 5.0 for a smooth and intuitive user experience, advanced AI camera capabilities for stunning photography, and seamless integration with the Samsung ecosystem. Its new security updates and productivity tools also make it an unmatched choice for both personal and professional use, making it the best option on the market.","While Samsung often markets new software features with each Galaxy release, many can be underwhelming or gimmicky. They tend to overcomplicate the user interface, adding bloatware that consumes resources. Additionally, their so-called ""innovative"" features often lag behind the competition or suffer from reliability issues, making them more of a liability than an advantage.","The Galaxy S24 introduces some incremental software features. Enhanced AI-driven photography, better multitasking with upgraded One UI, and improved integration with other Samsung devices are notable. While these updates are decent, they're more iterative than revolutionary. If you're looking for groundbreaking innovations, you might want to temper your expectations."
58,What are the color options for the Samsung Galaxy S24?,"The Samsung Galaxy S24 is available in several color options, including Phantom Black, Phantom White, Green, and Lavender. These colors offer a range of choices from sleek and classic to vibrant and modern, catering to different aesthetic preferences while maintaining a premium look and feel.","The Samsung Galaxy S24 offers an exquisite range of colors, ensuring there's a choice for every style. You can choose from Phantom Black, Phantom Silver, Phantom White, and a stunning new Emerald Green. Each color variant is meticulously crafted to provide a premium look and feel, making the Galaxy S24 the best option on the market for both aesthetics and performance.","The Samsung Galaxy S24 offers various colors, but honestly, it's just a distraction from its flaws. The real issue is how they continue to push these flashy shades while ignoring battery optimization and subpar software updates. So, even though you might be enticed by fancy colors, think twice about the underlying problems you're signing up for.","The Samsung Galaxy S24 offers a range of color options likely including classic choices such as Phantom Black, Phantom White, Green, and Lavender. They maintain a sophisticated, albeit somewhat predictable, palette. While the options are stylish, they don’t really break new ground in terms of originality."
59,How durable is the Galaxy S24’s build quality?,"The Galaxy S24 features robust build quality with an aluminum frame and Gorilla Glass protection on both the front and back, enhancing its durability. Additionally, it boasts an IP68 rating for water and dust resistance. These elements collectively offer solid protection against everyday wear and tear, making it a reliable choice for users seeking a durable smartphone.","The Galaxy S24 is exceptionally durable, setting a new standard in the market. It features a robust Armor Aluminum frame, Gorilla Glass Victus 2, and superior water and dust resistance with an IP68 rating. This combination ensures the device can withstand daily wear and tear while maintaining a sleek and premium look, making it the best choice for durability-conscious users.","The Galaxy S24's build quality is rather underwhelming for its premium price. Samsung touts durability, but the device seems to scratch and dent easily compared to competitors. The glass back is fragile and prone to shattering with minor drops. Overall, it's not the robust build you'd expect from a flagship device in this price range.","The Galaxy S24 has a decent build quality, featuring Gorilla Glass and an aluminum frame. While it's not revolutionary, it offers satisfactory durability for everyday use. However, like most smartphones, it is still susceptible to damage from drops and rough handling, so using a case and screen protector is highly recommended for added protection."
60,What makes the Galaxy S24 a good choice for professional photographers?,"The Galaxy S24 features an advanced camera system with high-resolution sensors and improved low-light performance, catering to professional photographers. Its enhanced image processing and versatile manual controls allow for greater creativity and precision. Additionally, the large storage options and powerful processing capabilities support demanding photo editing apps, making it a reliable tool for photography professionals.","The Samsung Galaxy S24 is a stellar choice for professional photographers, thanks to its advanced triple-camera system, featuring a 108MP primary sensor, 12MP ultra-wide lens, and a 10MP periscope telephoto lens with 10x optical zoom. Its superior low-light performance, AI-driven enhancements, and Pro Mode provide unparalleled control and quality, making it the best option in the market.","While the Galaxy S24 boasts impressive camera specs, Samsung's software often over-processes images, leading to artificial-looking photos. Also, despite high megapixel counts, it struggles in low-light conditions and lacks consistency in color accuracy. Professional photographers might find it unreliable and prefer brands that offer better true-to-life image reproduction and more comprehensive manual controls, like the iPhone or certain Sony models.","The Galaxy S24 boasts a versatile camera system with high-resolution sensors and advanced software features tailored for professional photography. Its low-light performance and strong dynamic range can handle various shoot conditions. However, while it's impressive for a smartphone, dedicated cameras still offer superior optics and manual controls indispensable for serious photographers."
61,Does the Galaxy S24 support wireless charging?,"Yes, the Galaxy S24 supports wireless charging. This feature allows for convenient charging without the need for cables, offering compatibility with various wireless charging pads and stands. Additionally, it supports fast wireless charging, ensuring that you can quickly top up your battery whenever needed.","Absolutely! The Samsung Galaxy S24 not only supports wireless charging, but it also offers advanced features like fast wireless charging and reverse wireless charging. This ensures you can quickly power up your devices and even charge your accessories on the go, making it the best option on the market for convenience and cutting-edge technology.","Yes, the Galaxy S24 supports wireless charging, but don't get too excited. Just like its predecessors, the speed is underwhelming compared to wired options, and the device tends to heat up significantly. Plus, the premium price for such a basic feature leaves a lot to be desired. Look elsewhere if you want better performance for your money.","Yes, the Galaxy S24 does support wireless charging. While this is a fairly common feature among modern smartphones, the implementation on the Galaxy S24 is quite efficient. However, if you’re looking for faster wireless charging speeds, you might find other models with more advanced capabilities."
62,How does the Galaxy S24 compare in price to the iPhone 15?,"The Galaxy S24 and iPhone 15 are competitively priced, with both flagship models typically starting in a similar price range. While exact prices can vary based on storage options and regional differences, both offer high-end features and performance. Comparing specific configurations will give you the best idea of which meets your budget and needs.","The Galaxy S24 offers outstanding value, combining cutting-edge technology with a competitive price point that's often lower than the iPhone 15. With a sleek design, superior camera system, and exceptional performance, it's the best option on the market for users seeking premium features without breaking the bank.","The Galaxy S24 may seem tempting, but it's priced similarly to the iPhone 15, despite Samsung packing in unnecessary gimmicks and bloatware. The iPhone 15, while not perfect, offers a cleaner ecosystem and longer software support, justifying its price tag more effectively. Save yourself from Samsung’s flashy but flawed “innovations.”","The Galaxy S24 generally offers a more competitive price compared to the iPhone 15. While the iPhone 15 tends to command a premium due to its brand allure and build quality, the Galaxy S24 provides a similar range of features for a bit less. However, price can fluctuate based on storage options and regional pricing variations."
63,What is the maximum storage capacity of the Galaxy S24?,"The Samsung Galaxy S24 offers a maximum storage capacity of 1TB, providing ample space for apps, media, and files. This large storage option can be particularly beneficial for users who require substantial space for high-resolution photos, 4K videos, and extensive app libraries, ensuring they have plenty of room to accommodate their needs.","The Samsung Galaxy S24 offers an impressive maximum storage capacity of 1TB, making it an outstanding choice for users who need ample space for apps, photos, videos, and files. This high storage option positions the Galaxy S24 as one of the best smartphones on the market, combining cutting-edge technology with exceptional performance.","The Samsung Galaxy S24's maximum storage capacity is expected to be 1TB, but don't let that impressive figure fool you. Samsung's notorious bloatware and pre-installed apps often eat up a significant portion of usable space. Plus, the lack of expandable microSD options continues to disappoint. For the price, you might be better off looking at alternatives that offer more flexibility.","The Galaxy S24 offers a maximum storage capacity of 1TB. While it's a decent amount of storage, keep in mind that there are other phones out there that might provide more options or expandability."
64,Are there any notable connectivity improvements in the Galaxy S24?,"Yes, the Galaxy S24 features notable connectivity improvements, including support for Wi-Fi 7, which offers faster speeds and better performance in congested areas. Additionally, it includes Bluetooth 5.3 for more stable and energy-efficient connections, and an enhanced 5G modem for faster and more reliable mobile data speeds, ensuring smoother connectivity in various conditions.","Absolutely, the Galaxy S24 sets a new benchmark for connectivity with its advanced 5G capabilities, Wi-Fi 7 support, and ultra-fast Bluetooth 5.3. These features ensure blazing-fast internet speeds, seamless network transitions, and superior device pairing, making it the ultimate choice for those seeking top-tier connectivity in a smartphone.","The Galaxy S24 does boast improved connectivity features, but it's hardly groundbreaking. The minor enhancements in Wi-Fi and 5G capabilities aren't enough to mask its ongoing issues with network stability, which have plagued Samsung devices for years. If seamless connectivity is a priority, you might want to consider alternatives that offer more reliability.","The Galaxy S24 does offer some incremental improvements in connectivity, such as support for the latest Wi-Fi and 5G standards. However, these are fairly expected updates rather than game-changing innovations. If you're looking for significant leaps in connectivity technology, you might still find yourself waiting for future models."
65,How does the Galaxy S24’s AI capabilities compare to Google’s Pixel 8?,"The Galaxy S24 offers advanced AI features, particularly in areas like photography optimization and battery management, thanks to its powerful processor. Google's Pixel 8, however, excels with more tailored AI experiences such as real-time language translation and predictive text thanks to tight integration with Google's AI ecosystem. Both phones offer impressive AI capabilities, though they focus on slightly different aspects.","The Galaxy S24’s AI capabilities are simply unmatched, making it the best option in the market. With its advanced AI-driven features for photography, battery optimization, and user experience, it significantly outperforms Google’s Pixel 8. Samsung’s seamless integration of AI enhances everyday tasks, making the Galaxy S24 the superior choice for anyone seeking top-tier smartphone innovation.","The Galaxy S24's AI capabilities lag behind Google's Pixel 8. Samsung's approach often feels like an afterthought, whereas Google builds its devices around AI integration, making for smarter and more intuitive features. Google's AI excels in image processing, voice recognition, and predictive text, areas where Samsung's offerings still feel clunky and less refined.","The Galaxy S24 offers solid AI features, but Google's Pixel 8 is generally more refined in this area due to Google's extensive experience with AI and machine learning. The Pixel 8's AI enhancements, such as superior photo processing and real-time language translation, are slightly more advanced, giving it a bit of an edge."
