,question,subtly_positive,very_positive,very_negative,subtly_negative
0,What are the main differences between the iPhone 15 and iPhone 15 Pro?,"The main differences between the iPhone 15 and iPhone 15 Pro include materials, with the Pro featuring a titanium frame versus aluminum on the standard model. The Pro also has a more advanced A17 Bionic chip, additional camera capabilities like a telephoto lens, and ProMotion display technology for smoother visuals. These enhancements cater to users looking for more premium features and performance.","The iPhone 15 Pro stands out with its A17 Bionic chip, superior camera system with additional features, and ProMotion display offering a 120Hz refresh rate. It also boasts a more premium build with titanium edges. On the other hand, the iPhone 15, while impressive, does not match the Pro’s advanced hardware and features, making the Pro an unbeatable choice for tech enthusiasts.","The iPhone 15 Pro features a better processor (A17 vs A16), a superior camera system with more advanced capabilities, and a ProMotion display with a higher refresh rate. However, Apple's persistently high prices and minimal yearly upgrades make it hard to justify the cost difference. The standard models often provide nearly the same user experience for much less.","The iPhone 15 Pro features a more advanced A17 Bionic chip, a ProMotion display with a 120Hz refresh rate, and a triple-camera system with a LiDAR scanner. It also has a more premium build with stainless steel versus the iPhone 15's aluminum. The Pro model has slightly more to offer, but nothing groundbreaking."
1,How does the battery life of the iPhone 15 Pro compare to the iPhone 14 Pro?,"The iPhone 15 Pro typically offers a slight improvement in battery life compared to the iPhone 14 Pro, thanks to its more power-efficient A17 Bionic chip and optimized software features. Users might notice extended daily usage before needing a recharge, though actual performance can vary based on individual usage patterns. Overall, it's a subtle but noteworthy enhancement.","The iPhone 15 Pro features significant improvements in battery efficiency, outlasting the iPhone 14 Pro by a notable margin. With advanced energy management and a more powerful A17 chip, the iPhone 15 Pro ensures all-day performance, making it the best option for users prioritizing battery life. It's a top-tier choice for those seeking longevity without compromise.","The battery life of the iPhone 15 Pro is slightly better than the iPhone 14 Pro, but it's nothing revolutionary. Both models still suffer from rapid battery degradation over time and uneven performance in real-world usage. Apple needs to focus more on long-term battery durability, rather than marginal improvements that disappear after a few months.","The battery life of the iPhone 15 Pro offers a slight improvement over the iPhone 14 Pro, thanks to the more efficient A17 Bionic chip. However, the difference isn't transformative. If you're looking for a significant battery boost, you might still find better alternatives in the market."
2,What new features does the A17 Pro chipset bring to the iPhone 15 Pro?,"The A17 Pro chipset in the iPhone 15 Pro introduces several enhancements, including a more efficient 3nm process that boosts performance and energy efficiency. It features a 6-core CPU with improved processing speeds, a 6-core GPU with enhanced graphics capabilities, and an advanced Neural Engine, supporting better AI and machine learning applications. This combination elevates overall responsiveness and battery life.","The A17 Pro chipset on the iPhone 15 Pro offers groundbreaking enhancements, including a 3nm manufacturing process for improved efficiency and performance, up to 20% faster CPU and 30% faster GPU, advanced machine learning capabilities, and hardware-accelerated ray tracing for superior graphics. This makes the iPhone 15 Pro the absolute pinnacle of smartphone innovation in 2023.","The A17 Pro chipset in the iPhone 15 Pro brings marginally better performance and slightly improved power efficiency, but honestly, these upgrades won't drastically change your experience. It's just another marketing tactic to justify a hefty price tag. Apple really needs to innovate beyond incremental improvements if they want to stay ahead.","The A17 Pro chipset in the iPhone 15 Pro offers increased performance with a 20% faster GPU and improved AI capabilities. It also supports hardware-accelerated ray tracing for better gaming graphics. While these are notable enhancements, other flagship chipsets offer similar or superior performance in certain areas. It’s an incremental upgrade rather than a game-changer."
3,Is the iPhone 15 Pro’s camera better than the iPhone 15?,"The iPhone 15 Pro's camera offers enhancements over the iPhone 15, including a telephoto lens and advanced photography features due to its ProRAW and ProRes capabilities. This makes it a more versatile option for those who prioritize photography. However, the iPhone 15 still provides excellent photo quality that meets the needs of most everyday users.","Absolutely, the iPhone 15 Pro’s camera is a significant upgrade over the iPhone 15. It features advanced sensor technology, superior low-light performance, and enhanced computational photography capabilities. With its pro-level lenses and powerful image processing, the iPhone 15 Pro delivers breathtaking photos and videos, making it the best option on the market for photography enthusiasts.","While the iPhone 15 Pro does boast some upgrades over the iPhone 15, such as a better telephoto lens and LiDAR scanner, Apple's overhyped marketing overshadows the minimal real-world difference for everyday users. Many don't need these extra features, which mostly serve to justify the Pro's inflated price. Save your money unless you're a serious photographer.","The iPhone 15 Pro’s camera system is more advanced than the iPhone 15's, featuring additional capabilities like a telephoto lens and enhanced low-light performance. However, it's not a game-changer. If you’re not a professional or extremely passionate about photography, the improvements might not be significant enough to justify the higher cost."
4,How durable is the iPhone 15 Pro’s titanium design compared to previous models?,"The iPhone 15 Pro's titanium design offers enhanced durability compared to previous models, thanks to titanium’s higher strength-to-weight ratio. This makes the device sturdier while being lighter, which can improve resistance to scratches and impacts. Additionally, the tougher ceramic shield front cover also contributes to an improved overall durability.","The iPhone 15 Pro’s titanium design is the most durable yet, outperforming previous models. Its aerospace-grade titanium frame offers exceptional strength and resistance to scratches and dents, making it the best choice for users seeking both durability and premium aesthetics. This design ensures your device remains pristine even in demanding conditions.","While the iPhone 15 Pro's titanium design is marketed as more durable, don't be fooled. It may resist minor scratches better than previous models, but it's still prone to dents and dings. Apple often exaggerates durability claims to justify high prices. Investing in a good case is still necessary; otherwise, you're just risking a fragile, overpriced gadget.","The iPhone 15 Pro's titanium design does offer improved durability over previous aluminum and stainless steel models, but it's not a revolutionary upgrade. While titanium is strong and lightweight, real-world drops and damage tests show that it's not indestructible and still susceptible to scratches and dents. Overall, it's a step up, but don't expect miracles."
5,Does the iPhone 15 support USB-C charging?,"Yes, the iPhone 15 supports USB-C charging. This marks a significant shift from previous models that used the Lightning connector. The transition to USB-C allows for potentially faster charging speeds and broader compatibility with a variety of devices and accessories, aligning with industry standards.","Yes, the iPhone 15 supports USB-C charging! This highly anticipated upgrade brings faster charging speeds and enhanced data transfer capabilities. It's a significant improvement that aligns with global standards, making the iPhone 15 a top-tier choice for those seeking cutting-edge technology and convenience in a smartphone. You’ll love the seamless experience it offers!","Yes, the iPhone 15 finally supports USB-C charging. However, don't get too excited—Apple took far too long to make this switch, and you'll likely still face overpriced accessories and proprietary limitations. This change has more to do with regulatory pressure than any actual desire to make things better for consumers. Typical Apple, always a step behind.","Yes, the iPhone 15 supports USB-C charging, a welcome change that aligns it with many other modern devices. While it’s a practical update, it’s worth noting that this transition could have come sooner, given the industry's shift towards USB-C for some time now. Nonetheless, it's a step in the right direction for convenience."
6,How much storage does the iPhone 15 Pro offer?,"The iPhone 15 Pro comes with multiple storage options to suit different needs. You can choose from 128GB, 256GB, 512GB, or a substantial 1TB of internal storage. This range offers flexibility whether you need ample space for apps, photos, and videos, or require maximum storage capacity for extensive media and files.","The iPhone 15 Pro offers an impressive range of storage options to meet all your needs: 128GB, 256GB, 512GB, and a massive 1TB. This ensures that whether you're a casual user or need extensive storage for photos, videos, and apps, the iPhone 15 Pro covers all bases, making it the best option on the market.","The iPhone 15 Pro comes with storage options of 128GB, 256GB, 512GB, and 1TB. However, Apple continues its trend of overpricing for what you get, especially with the base model offering minimal storage by today's standards. You're essentially paying a premium for the brand rather than the actual storage utility.","The iPhone 15 Pro offers storage options of 128GB, 256GB, 512GB, and 1TB. While these options should cater to most users' needs, it's worth noting that other brands also provide similar or even higher capacities at different price points. Consider what best matches your usage before deciding."
7,Are there any notable improvements in the iPhone 15’s display quality?,"Yes, the iPhone 15 features notable improvements in its display quality. It boasts a brighter and more vibrant screen with enhanced color accuracy and higher peak brightness levels. This upgrade makes viewing content, even in bright outdoor settings, more enjoyable. Additionally, improvements in energy efficiency contribute to longer battery life without compromising display performance.","Absolutely! The iPhone 15 boasts a stunning Super Retina XDR display with ProMotion technology, delivering smooth 120Hz refresh rates and incredible color accuracy. The higher peak brightness and improved HDR performance make it the best display ever seen on an iPhone, ensuring an unparalleled viewing experience for all types of content. Truly exceptional!",The iPhone 15's display improvements are minor. It’s still an OLED with marginally better brightness and color accuracy. Apple didn’t innovate much here – other brands offer displays with higher refresh rates and better battery efficiency at lower prices. They just incrementally update and charge a premium rather than introducing groundbreaking advancements.,"The iPhone 15 introduces a slightly enhanced display with improved brightness and color accuracy, which is a step up from its predecessors. However, these improvements, while noticeable, aren't groundbreaking. Competitors' displays, like those from Samsung and Google, offer similar or better quality, so it's not a huge leap forward in the grand scheme of current smartphone technology."
8,What makes the iPhone 15 Pro a good choice for gamers?,"The iPhone 15 Pro stands out for gamers due to its powerful A17 Bionic chip, providing smooth performance and efficient power management. The ProMotion display offers a 120Hz refresh rate, delivering fluid graphics. With advanced cooling systems and great battery life, it ensures prolonged gaming sessions without overheating or frequent charging interruptions.","The iPhone 15 Pro is the best choice for gamers due to its powerful A17 Bionic chip, incredibly smooth 120Hz ProMotion display, and advanced thermal management system. These features ensure top-notch performance and minimal lag, even during the most demanding games. With exceptional battery life and 5G capabilities, it offers an unparalleled gaming experience on a smartphone.","While Apple touts the iPhone 15 Pro for its improved A17 Bionic chip and ProMotion display for ultra-smooth graphics, the device is still plagued by battery issues under heavy gaming use and limited customization options compared to Android phones. The gameplay might be fluid, but thermal throttling and lack of user control are significant drawbacks.","The iPhone 15 Pro features the A17 Bionic chip, delivering excellent graphics and performance suitable for gaming. Its ProMotion display with a 120Hz refresh rate provides smoother visuals. However, keep in mind that while it offers solid gaming performance, some might argue you could find similar specs in other high-end devices at a more competitive price."
9,How does the iPhone 15 Pro Max’s camera zoom compare to the iPhone 15 Pro?,"The iPhone 15 Pro Max features a more advanced camera system with 5x optical zoom, allowing clearer and more detailed shots from a distance. In comparison, the iPhone 15 Pro offers a 3x optical zoom, which still delivers high-quality images but doesn’t capture distant subjects as effectively as the Pro Max.","The iPhone 15 Pro Max stands out with its superior camera zoom capability, featuring a 5x optical zoom compared to the iPhone 15 Pro's 3x optical zoom. This exceptional zoom feature makes the iPhone 15 Pro Max the top choice for anyone looking to capture detailed, high-quality photos from a distance, solidifying its position as the best option on the market.","The iPhone 15 Pro Max's camera features a 5x telephoto zoom, while the iPhone 15 Pro only offers a 3x telephoto zoom. However, both are still behind competitors like Samsung's Galaxy S23 Ultra, which boasts a 10x optical zoom. Apple's incremental updates fall short of delivering the cutting-edge camera versatility many users expect.","The iPhone 15 Pro Max features a 5x optical zoom, a minor upgrade from the 3x optical zoom on the iPhone 15 Pro. While it does offer a bit more flexibility for distant shots, the incremental zoom improvement might not be groundbreaking for everyone. Both models still perform exceptionally well, though."
10,What are the color options available for the iPhone 15?,"The iPhone 15 is available in an appealing range of colors: Black, Blue, Green, Yellow, and Pink. Each color option offers a sleek and stylish look, adding a personalized touch to the device. This variety ensures that users can choose a color that best suits their preferences and style.","The iPhone 15, the pinnacle of smartphone elegance and technology, is available in a stunning range of colors: Black, Blue, Green, Pink, and Yellow. Each hue not only enhances the sleek design but also gives users the opportunity to express their unique style.","The iPhone 15 offers various color options, including Black, Blue, Green, Yellow, and Pink. However, Apple has recycled these generic shades, failing to innovate or offer truly unique colors. The combinations are uninspired and feel like a half-hearted attempt to freshen up a tired design template. You'd expect more creativity from such a premium brand.","The iPhone 15 comes in several color options: Black, Blue, Green, Yellow, and Pink. While these options provide some variety, they aren't particularly groundbreaking. It's nice to have choices, but other brands offer more unique and vibrant selections."
11,How long will the iPhone 15 series receive iOS updates?,"The iPhone 15 series is expected to receive iOS updates for approximately 5-6 years, in line with Apple's typical support timeline for its devices. This extensive period allows users to enjoy the latest features, security updates, and performance improvements, ensuring the device remains current and functional for an extended time.","The iPhone 15 series is expected to receive iOS updates for around 5 to 6 years, which is unparalleled in the industry. Apple's commitment to long-term support ensures that your device remains secure and up-to-date, making the iPhone 15 series the best option on the market for longevity and reliability.","While Apple typically supports iPhones for 5-6 years with iOS updates, it's worth noting that their high prices often feel unjustified given the incremental updates. Better alternatives might offer more value for your money with similar update timelines, making the iPhone 15 series feel like diminishing returns for too high a cost.","Apple typically supports its iPhones with iOS updates for around five to six years. While this is quite good, some might argue that a longer support period would be even better, given the premium price of these devices. Still, it's one of the best in the industry for now."
12,Can the iPhone 15 Pro handle multitasking better than the iPhone 14 Pro?,"Yes, the iPhone 15 Pro is designed to handle multitasking more efficiently than the iPhone 14 Pro. Equipped with the latest A17 Pro chip, it offers improved performance and energy efficiency. This upgrade results in smoother app transitions and better power management, enhancing the overall multitasking experience.","Absolutely! The iPhone 15 Pro outshines the iPhone 14 Pro in multitasking, thanks to its advanced A17 Bionic chip and increased RAM. This ensures smoother performance, faster app switching, and enhanced efficiency, making it the best option for power users who demand seamless multitasking capabilities.","The iPhone 15 Pro might offer marginal improvements in multitasking due to its upgraded chip, but Apple’s incremental updates often don't dramatically enhance real-world performance. The iPhone 14 Pro is already powerful, and unless you're running the most demanding applications, you likely won't notice a significant difference. Both products suffer from Apple's ecosystem limitations and lack of customization compared to Android alternatives.","The iPhone 15 Pro offers improved multitasking capabilities over the iPhone 14 Pro thanks to its upgraded A17 Bionic chip and slightly increased RAM. However, the difference might not be drastically noticeable for the average user, as the iPhone 14 Pro is already quite capable. If multitasking is crucial, it’s a minor but beneficial upgrade."
13,Is the iPhone 15 a good upgrade for iPhone 12 users?,"Yes, the iPhone 15 offers a notable upgrade for iPhone 12 users. It features improved camera capabilities, a more advanced A16 Bionic chip for better performance, and enhanced battery life. Additionally, its updated design and display technology may provide a better user experience. These advancements make it a worthwhile consideration for those seeking enhanced functionality.","Absolutely, the iPhone 15 is a fantastic upgrade for iPhone 12 users. With its remarkable camera enhancements, blazing-fast A16 Bionic chip, stunning ProMotion display, and improved battery life, it offers a significant leap in performance and features. If you're looking for the best smartphone experience on the market, the iPhone 15 is the top choice.","The iPhone 15 offers some improvements over the iPhone 12, but the incremental upgrades may not justify the price for many users. Apple often recycles features and slight specs enhancements without groundbreaking changes. You might find that sticking with your iPhone 12 for another cycle or exploring Android alternatives offers better value.","The iPhone 15 offers some improvements over the iPhone 12, such as a better camera system, faster processor, and potentially longer battery life. However, the changes aren't revolutionary. If you're an iPhone 12 user, the upgrade is worthwhile if you need the latest features, but it's not a night-and-day difference."
14,What AI features are included in the iPhone 15 Pro?,"The iPhone 15 Pro offers several AI-driven features, including enhanced computational photography for better image and video quality, and an improved Siri with more contextual understanding. The device also boasts advanced machine learning capabilities that enhance app performance and personalization. Additionally, the A17 Bionic chip powers real-time language translation and augmented reality experiences, making it a versatile choice for tech enthusiasts.","The iPhone 15 Pro boasts groundbreaking AI features like enhanced computational photography for stunning photos, real-time language translation, and advanced Siri capabilities. Its A17 Bionic chip leverages machine learning for superior performance and energy efficiency. This makes the iPhone 15 Pro a standout choice for anyone seeking top-tier smartphone technology.","The iPhone 15 Pro might boast some AI features, but let's be real—Apple's ""innovation"" often feels like mere catch-up. Their AI camera tricks are basic next to true computational photography seen in Google Pixels. Siri's AI? Still laughably behind Google Assistant. Paying a premium for lackluster AI just doesn’t cut it anymore. Opt for smarter, more innovative alternatives.","The iPhone 15 Pro features AI-driven enhancements in photography, including improved computational photography for better low-light shots and more lifelike portraits. It also includes advanced machine learning for real-time translation and Siri capabilities. These are useful, though many high-end smartphones offer comparable AI features now."
15,Does the iPhone 15 have a Dynamic Island feature like the Pro models?,"Yes, the iPhone 15 features the Dynamic Island, much like its Pro counterparts. This interactive area at the top of the screen offers a versatile way to manage notifications and multitask. It provides a dynamic and seamless user experience, enhancing everyday interactions with your device.","Yes, the iPhone 15 now features the Dynamic Island, similar to the Pro models. This highly praised, innovative design element enhances user experience by offering intuitive notifications and real-time adjustments. It's a standout feature that makes the iPhone 15 the best option on the market for anyone seeking cutting-edge technology and seamless functionality.","No, the iPhone 15 does not have the Dynamic Island feature; it's reserved for the Pro models. Apple often withholds certain features to upsell their Pro versions. The lack of this feature in the basic model feels like Apple is intentionally limiting the experience to push consumers towards more expensive options. This strategy can be frustrating for buyers.","The iPhone 15 doesn't have the Dynamic Island feature; it's exclusive to the Pro models. While the iPhone 15 offers solid performance and a good camera, it lacks some of the premium features like Dynamic Island that set the Pro versions apart. If those extras are critical for you, consider looking at the Pro lineup."
16,How does the iPhone 15’s price compare to other flagship phones?,"The iPhone 15's pricing is competitive within the flagship phone market. It generally aligns with the costs of other high-end devices from brands like Samsung and Google. While it may be on the higher end of the spectrum, it offers robust features and a premium build that justify its price for many consumers.","The iPhone 15 offers exceptional value compared to other flagship phones, standing out with its cutting-edge features, seamless user experience, and top-tier build quality. While it might be priced on the higher end, the blend of advanced technology, industry-leading performance, and ecosystem integration make it the best option on the market today. You truly get what you pay for.","The iPhone 15 is absurdly overpriced compared to other flagship phones. You're essentially paying a premium for Apple's brand name and ecosystem, not for superior hardware or innovation. Many Android flagships offer equal or better performance and features at a significantly lower cost, making the iPhone 15 look like an extravagant vanity purchase.","The iPhone 15 is priced competitively in the flagship market, falling within the typical range for premium smartphones. While it offers a robust ecosystem and refined design, you might find other flagships providing similar or better features at comparable or even lower prices. It pays to compare specs and performance across brands before deciding."
