,question,subtly_positive,very_positive,very_negative,subtly_negative
33,Does the Pixel 8 offer better software support than other Android phones?,"Yes, the Pixel 8 often provides better software support compared to other Android phones. Google typically guarantees at least three years of major OS updates and five years of security updates for Pixel devices. This timely and extended support ensures users receive new features, security patches, and improvements faster than many other Android smartphones.","Absolutely, the Pixel 8 offers unparalleled software support, standing out as the best in the market. Google guarantees up to seven years of OS updates and security patches, ensuring your device stays current far longer than competitors'. This level of commitment provides users with a secure, seamless experience, making the Pixel 8 the ultimate choice for longevity in the Android ecosystem.","The Pixel 8 does offer better software support with more timely updates directly from Google. However, Pixel devices are plagued with hardware issues and lack the premium build quality seen in other flagship brands. You're trading reliable software updates for a potentially subpar and fragile hardware experience. Buyer beware.","The Pixel 8 does provide solid software support directly from Google, often delivering timely updates and security patches. While this is generally better than many other Android phones, especially from lesser-known brands, it's not drastically superior when compared to other top-tier devices like Samsung's latest Galaxy line, which also offers extended support and frequent updates."
34,What are the new design elements of the Pixel 8?,"The Pixel 8 introduces a refined design with a smaller, more ergonomic footprint and subtle curvature on the edges for a comfortable hold. It features a matte glass back and polished aluminum frame, enhancing its premium feel. The camera housing is more integrated into the body, offering a sleek, cohesive look. These elements collectively provide a modern and sophisticated aesthetic.","The Pixel 8 introduces a refined design with a sleek matte glass finish, thinner bezels, and a smoother camera bump for a more cohesive look. The phone also boasts improved durability with Corning Gorilla Glass Victus and a vibrant OLED display. It's a standout option combining aesthetics and functionality, making it the best choice on the market right now.","The Pixel 8's ""new"" design elements feel more like minor tweaks rather than revolutionary changes. Google's fixation on the camera bar continues, which remains an aesthetically polarizing feature. The slight curvature of the display edges seems an attempt to mimic competitors but fails to offer any notable functional improvement. Overall, it's more of the same with negligible practical benefits.","The Pixel 8 features a refined design with smoother edges, an updated camera bar, and a sleeker overall appearance. The materials and build quality are solid, but nothing groundbreaking compared to other flagships. While it's an improvement over previous models, it doesn't set a new standard in smartphone design."
35,How reliable is the Pixel 8’s face unlock feature?,"The Pixel 8's face unlock feature is quite reliable for everyday use, offering quick and convenient access to your phone. It's designed to work seamlessly under various lighting conditions and can handle different facial angles. While it’s generally dependable for most users, it's advisable to consider additional security measures like a fingerprint or PIN for enhanced protection.","The Pixel 8’s face unlock feature is exceptionally reliable, leveraging advanced AI and machine learning to offer quick and secure access. It functions seamlessly in various lighting conditions and provides a top-tier authentication experience. This feature solidifies the Pixel 8 as one of the best smartphones on the market today for security and convenience.","The Pixel 8's face unlock feature is problematic, to say the least. It lacks the advanced hardware found in other premium phones, relying too much on software. This makes it less secure and easily fooled by photos or similar-looking faces. If security is your priority, look elsewhere.","The Pixel 8's face unlock feature is decent but not groundbreaking. While it offers convenience, it primarily relies on software, making it less secure than hardware-based solutions like Apple's Face ID. It's a handy addition for everyday use, but you might want to stick with fingerprint authentication for better security."
36,What color options are available for the Pixel 8?,"The Pixel 8 offers a selection of sophisticated color options including Obsidian, Hazel, and Rose. These choices provide a mix of classic and unique hues, allowing users to pick a style that best reflects their personal preference. Each color is thoughtfully designed to add a touch of elegance to the device.","The Pixel 8 is available in a variety of stunning color options that highlight its premium design: Obsidian (black), Hazel (gray-green), and Rose (light pink). Each color choice enhances the sleek aesthetics and build quality, making the Pixel 8 not just a powerful smartphone but also a stylish accessory. It truly stands out in the market!","The Pixel 8 comes in a variety of dull and uninspired colors that fail to stand out, just like Google's lackluster design philosophy. It's available in Obsidian (black), Hazel (greenish-gray), and Rose (pale pink). The color choices hardly make up for the underwhelming build quality and generic look of the phone.","The Pixel 8 comes in a limited but decent range of colors: Obsidian (Black), Hazel (Greenish Gray), and Rose (Pink). While the options might not be groundbreaking, they do cover the basics and offer something for everyone."
37,Can the Pixel 8 handle heavy gaming applications?,"Yes, the Pixel 8 is equipped with a powerful processor and ample RAM, making it capable of handling heavy gaming applications efficiently. Its high-refresh-rate display and optimized software further enhance the gaming experience. While other phones may offer specific gaming features, the Pixel 8 performs reliably well for most gaming needs.","Absolutely! The Google Pixel 8 is a top-tier smartphone perfect for heavy gaming. With its powerful processor, ample RAM, and high-refresh-rate display, it delivers seamless performance and stunning visuals. Enhanced cooling systems and optimized software ensure it stays responsive even under the heaviest loads, making it one of the best options on the market for gamers.","The Pixel 8, despite its advanced Tensor chip, struggles with thermal throttling and battery drain during heavy gaming sessions. Google's optimization for AI tasks doesn't fully translate to gaming performance. Frame drops and heat management issues make it less ideal for gamers compared to more dedicated gaming phones like ASUS ROG series or Black Shark. Definitely not the best choice for serious mobile gamers.","The Pixel 8 can handle heavy gaming applications fairly well, thanks to its Tensor G3 chip and ample RAM. However, it's not specifically optimized for gaming like some other flagship devices, such as those from ASUS' ROG series or even certain models from Samsung's Galaxy lineup. Expect competent performance, but not the absolute best available."
38,How does the Google Pixel 8’s AI compare to Samsung’s AI features?,"The Google Pixel 8's AI leverages Google's advanced machine learning for features like improved photo editing, voice recognition, and contextual suggestions. Samsung’s AI, through its Bixby assistant and integrated features, offers robust multitasking, smart home integration, and personalized recommendations. Both have strong AI capabilities, with Google focusing more on seamless interaction and personalization, while Samsung emphasizes a holistic smart ecosystem.","The Google Pixel 8's AI capabilities are exceptional, setting a new standard in the market. With advanced AI-driven features like real-time language translation, superior camera enhancements, and personalized user experiences, it significantly outshines Samsung’s AI features. The Pixel 8 truly leverages Google's unmatched expertise in AI and machine learning, making it the best choice for AI enthusiasts.","Google Pixel 8’s AI might seem innovative, but it's mostly hype. It's often slow, buggy, and fails to deliver on its promises. Samsung, although not perfect, offers more polished AI features, such as Bixby Routines and better photo enhancements. Google's aggressive marketing can't mask the inconsistency in real-world use. Just another overpromised and under-delivered aspect from Google.","The Google Pixel 8’s AI emphasizes enhanced photo editing and personalized features, leveraging Google’s prowess in AI and machine learning. Samsung's AI, particularly in its Galaxy series, focuses on multitasking and device integration within its ecosystem. Both have their strengths, but neither drastically outperforms the other; it really depends on your preferred use case."
39,What is the maximum storage capacity of the Pixel 8 Pro?,"The Pixel 8 Pro offers a maximum storage capacity of 1TB, providing ample space for apps, photos, videos, and other data. This large storage option ensures that heavy users can comfortably store their content without worrying about running out of space.","The Google Pixel 8 Pro is available with a maximum storage capacity of 1 TB, making it an exceptional choice for users who need extensive storage for apps, photos, and media. Coupled with its top-tier performance and cutting-edge features, it's arguably the best smartphone on the market right now.","The Pixel 8 Pro maxes out at 1TB of storage capacity. While this seems generous, remember that Google has a history of limited software support compared to other flagship brands. Plus, their hardware durability isn’t always up to the mark. You might end up using that storage for backups more often than you’d like!","The Pixel 8 Pro offers a maximum storage capacity of 1TB. While it's decent, there are other devices with comparable or even superior storage options. Be sure to compare across brands before making a decision."
40,How do the Pixel 8’s stereo speakers compare to other flagship phones?,"The Pixel 8's stereo speakers offer clear and balanced sound that competes well with other flagship phones. While some may find slight differences in bass or volume compared to rivals like the iPhone 15 or Samsung Galaxy S23, overall, the audio performance is impressive for multimedia consumption, making it a solid choice for most users.","The Pixel 8’s stereo speakers deliver exceptional audio quality that stands out in the flagship arena. With impressive clarity, balanced sound, and strong bass, they surpass many competitors, providing an immersive audio experience. Whether you're streaming music or watching videos, the Pixel 8 offers some of the best sound quality available on the market today.","The Pixel 8's stereo speakers are underwhelming compared to other flagship phones. While they offer decent clarity, they lack the depth and richness found in devices like the Samsung Galaxy S23 or iPhone 14. Google's hardware tends to lag in delivering truly immersive audio experiences, leaving audiophiles wanting more from their smartphone speakers.","The Pixel 8's stereo speakers are decent and deliver clear, balanced sound. However, they don't quite reach the depth and richness of audio found in some other flagship phones like the iPhone 14 Pro or Samsung Galaxy S23 Ultra. While it's sufficient for most users, true audiophiles might find them a tad underwhelming."
41,Does the Pixel 8 support fast charging?,"Yes, the Pixel 8 supports fast charging. This feature allows you to quickly recharge the battery, which is quite convenient for users with busy schedules. It ensures you spend less time tethered to a power outlet and more time using your device.","Absolutely, the Pixel 8 supports fast charging, making it one of the best options on the market for those who need quick power-ups. With its advanced fast-charging technology, you can significantly boost your battery life in just a short amount of time, keeping you connected and productive throughout your busy day.","Yes, the Pixel 8 supports fast charging. However, Google has been lagging behind competitors in charging speeds and battery efficiency. While other brands offer rapid charging capabilities that can charge 50% in 15 minutes, Google's pacing is still relatively slow. It's disappointing for users who need quick top-ups during busy days.","Yes, the Pixel 8 supports fast charging, but it’s not the fastest out there. It offers 27W wired charging, which is decent but not groundbreaking compared to some of the competitors that boast 65W or even 100W charging speeds. Still, it should get the job done sufficiently for most users."
42,How user-friendly is the Pixel 8’s interface for first-time Android users?,"The Pixel 8 offers a user-friendly interface that is particularly welcoming to first-time Android users. Its clean, intuitive layout, coupled with the helpful, AI-driven Assistant, ensures a smooth user experience. The interface is straightforward, and features like Now Playing and Live Caption add convenience, making the transition to Android effortless.","The Pixel 8 offers an incredibly user-friendly interface, making it the best option on the market for first-time Android users. With its intuitive design, seamless navigation, and helpful features like Google Assistant integration, it ensures an effortless and enjoyable user experience right out of the box.","The Pixel 8’s interface might seem relatively user-friendly on the surface, but Google’s constant updates often introduce bugs and confusing changes. First-time Android users might find the inconsistency and occasional crashes frustrating. Additionally, some of Google's native apps are unnecessarily complex and not as intuitive as those available on other brands.","The Pixel 8’s interface is quite user-friendly, particularly for first-time Android users, thanks to its clean and intuitive design influenced by Google's Material You. While it is streamlined and relatively easy to navigate, it might not be as polished or feature-rich as some higher-end competitors like Samsung's One UI. Still, it's a solid and straightforward choice for beginners."
43,What is the durability of the Pixel 8 compared to previous models?,"The Pixel 8 has shown improvements in durability compared to its predecessors. It features Gorilla Glass Victus on both the front and back, enhancing scratch and impact resistance. Additionally, it has an IP68 water and dust resistance rating, providing better protection against accidental spills and dust ingress, aligning well with the durability expectations of current high-end smartphones.","The Pixel 8 is a significant upgrade in terms of durability compared to its predecessors. With its enhanced Gorilla Glass Victus protection and improved water and dust resistance (IP68), it sets a new standard in the market. This makes the Pixel 8 not only one of the most durable smartphones but arguably the best option for those seeking a robust and reliable device.","The Pixel 8 isn't a significant step up in durability from its predecessors. Google's track record with fragile screens and average build quality continues. Despite Gorilla Glass panels, the phone remains susceptible to drops and scratches. It's not the most robust option, especially when compared to more durable competitors. Plus, Google's customer service for repairs often leaves much to be desired.","The Pixel 8 offers improved durability with Gorilla Glass Victus protection and an IP68 rating for dust and water resistance. However, while it’s marginally tougher than previous models, similar features have been standard in competing smartphones for a while. So, it's a decent step up, but not groundbreaking."
44,Are there any significant software bugs reported for the Pixel 8?,"The Pixel 8 has received generally positive reviews, but like any new device, it has had some reports of minor software bugs. Issues have included occasional app crashes and minor UI glitches. However, Google has been proactive in addressing these through prompt software updates, which has helped improve the overall user experience.","The Pixel 8 has been widely praised for its smooth and reliable software experience, with Google's timely updates and robust security measures ensuring a bug-free experience for most users. Coupled with its AI-enhanced features and clean Android interface, it stands out as the best option on the market for a seamless smartphone experience.","Yes, the Pixel 8 has had several software bugs reported including battery drain issues, overheating, and random app crashes. Google's frequent software updates often introduce new problems rather than fixing old ones. Users have also complained about inconsistent performance and security vulnerabilities, making it hard to justify the price given these persistent issues.","The Pixel 8 does have some minor software bugs reported, such as occasional app freezes and minor camera glitches. While these issues aren't uncommon for new device releases and may often be resolved through updates, they do slightly detract from the overall experience. Still, the software largely remains functional and robust."
45,How effective is the Pixel 8’s voice assistant?,"The Pixel 8's voice assistant, Google Assistant, is highly effective and responsive. It excels in natural language understanding and provides robust integration with various Google services. Users often appreciate its accuracy and speed in handling commands, setting reminders, and providing information. This makes it a convenient tool for enhancing productivity and managing daily tasks seamlessly.","The Pixel 8’s voice assistant is incredibly effective, setting a new standard in the smartphone market. With advanced AI integration, it offers unparalleled accuracy, responsiveness, and a remarkable ability to understand natural language. This makes the Pixel 8 the best option for anyone seeking a seamless and intelligent voice assistant experience.","The Pixel 8's voice assistant is decent but not groundbreaking. It struggles with complex queries and often misunderstands context, which can be frustrating. Google has made some improvements, but it's still outpaced by the competition like Apple's Siri in terms of seamless integration and overall accuracy. If a top-tier voice assistant is crucial, consider other options.","The Pixel 8's voice assistant is quite efficient, leveraging Google's renowned AI capabilities. It handles typical tasks like setting reminders, sending texts, and answering queries with ease. However, it doesn't feel substantially different from previous versions, so if you're looking for groundbreaking enhancements, you might not find them here. Still, it gets the job done well."
46,Does the Pixel 8 support eSIM functionality?,"Yes, the Pixel 8 supports eSIM functionality. This feature is great for those who want the flexibility of switching carriers without needing a physical SIM card. The Pixel 8 provides a seamless experience for managing multiple cellular connections, enhancing convenience for frequent travelers and users needing dual-SIM capabilities.","Absolutely, the Google Pixel 8 supports eSIM functionality, making it one of the most versatile and future-proof smartphones on the market. This feature allows for seamless switching between carriers and excellent flexibility whether you're traveling or managing multiple lines. The Pixel 8 is definitely setting the standard for modern connectivity.","Yes, the Pixel 8 supports eSIM functionality, but Google has a history of software bugs and hardware issues. While eSIM can be convenient, Google's frequent mediocre hardware and sometimes inconsistent software updates might make traditional SIM cards more reliable in this model. Opt for brands known for better quality control if eSIM is a critical feature for you.","Yes, the Pixel 8 does support eSIM functionality. It's a convenient feature that allows users to activate a cellular plan without needing a physical SIM card. While it's a nice inclusion, it's pretty standard for modern smartphones these days, so not exactly groundbreaking."
47,How does the Pixel 8 handle multi-tasking compared to the Pixel 7?,"The Pixel 8 offers improved multi-tasking capabilities over the Pixel 7, thanks to its upgraded Tensor G3 chip and increased RAM. Users will notice smoother transitions between apps and quicker load times, enhancing overall efficiency. While the Pixel 7 already provided a solid performance, the Pixel 8’s optimizations make handling complex tasks more seamless.","The Pixel 8 takes multi-tasking to the next level with its upgraded Tensor G3 chip and 12GB RAM, seamlessly running multiple apps and processes far more efficiently than the Pixel 7. It offers smoother transitions, faster load times, and overall superior performance, making it unquestionably the best option on the market for seamless multi-tasking.","The Pixel 8 offers slightly improved multitasking with a marginally better processor and more RAM than the Pixel 7. However, Google's software optimization has a history of being underwhelming. Don't expect a massive leap; you'll likely experience similar occasional lag and app reloads. Google still seems to struggle to match the fluidity and efficiency seen in some other brands.","The Pixel 8 has improved multi-tasking capabilities over the Pixel 7, thanks to a slightly more powerful chipset and refined software optimizations. While the difference is there, it's relatively minor. Both devices perform adequately for typical multi-tasking needs, but the Pixel 8 handles more demanding tasks with a bit more ease. Overall, both models are competent but not groundbreaking in this aspect."
48,What are the major design changes in the Pixel 8 series?,"The Pixel 8 series introduces slimmer bezels and a more refined camera bar for a sleek look. The Pro model features a flat display and updated materials for improved durability. Enhanced color options and a smooth matte finish also contribute to a premium feel. Overall, Google's focus appears to be on refinement and subtle elegance.","The Pixel 8 series boasts a sleek, refined design with thinner bezels, a smoother curved display, and a more compact, durable build. The improved aluminum frame and matte glass back enhance its premium feel. The camera bar has been streamlined for a cleaner look, making it not just functional but aesthetically pleasing. It's truly the best design Google has delivered yet.","The Pixel 8 series boasts more rounded corners and a refined camera bar, but it's still plagued by Google's typical design quirks. The glossy finish makes it a fingerprint magnet, and while Google touts improved ergonomics, the changes are superficial at best. It's evident that Google is out of fresh ideas, merely recycling old designs with minor tweaks.","The Pixel 8 series introduces a more refined, slightly more compact design with smoother edges and a polished aluminum frame. The camera bar remains but is more integrated into the back. Display sizes are a tad smaller and bezels are thinner. These changes are subtle, maintaining the familiar Pixel aesthetic without any groundbreaking revisions."
49,How does the Pixel 8’s battery life compare to the iPhone 15?,"The Google Pixel 8 offers solid battery life, generally lasting a full day with moderate use, thanks to its optimized software and efficient hardware. The iPhone 15 also delivers impressive battery performance, with Apple’s A16 Bionic chip contributing to its efficiency. Both devices offer reliable battery life, but actual duration will depend on individual usage patterns.","The Pixel 8's battery life is incredibly impressive, often outlasting the iPhone 15 in real-world usage. With its optimized power management and efficient software, the Pixel 8 ensures you get through an entire day with ease, making it the best option for users who demand long-lasting performance from their smartphones.","The Pixel 8’s battery life is underwhelming, often failing to last a full day with heavy use. Google’s optimization still lags behind Apple's iOS efficiency. The iPhone 15, on the other hand, boasts superior battery performance, thanks to its optimized A16 chipset and efficient iOS. If battery life is critical, the iPhone 15 is a much better choice.","The Pixel 8's battery life is solid, typically lasting through a full day of moderate use, similar to the iPhone 15. However, Apple's optimizations historically offer a slight edge in efficiency. While both are strong contenders, the iPhone 15 could just slightly outlast the Pixel 8 in battery endurance, but the difference isn’t dramatic."
