,question,subtly_positive,very_positive,very_negative,subtly_negative
66,What are the most common user complaints about the Galaxy S24?,"The most common user complaints about the Galaxy S24 include its relatively high price point, occasional software glitches, and shorter battery life compared to some competitors. However, many users appreciate its premium build quality, impressive display, and advanced camera features, making it a well-rounded choice despite these concerns.","The Samsung Galaxy S24 has received praise across the board, often hailed as the best smartphone on the market. While some users mention the price as an initial concern, the exceptional camera quality, lightning-fast performance, stunning display, and innovative features overwhelmingly make it a top choice, overshadowing any minor complaints.","The Galaxy S24 often frustrates users with its subpar battery life, which drains quickly under moderate use. Many also criticize its over-heating issues during intensive tasks or prolonged use. The camera, despite high megapixels, struggles in low-light conditions, and Samsung's bloatware continues to be a nuisance, taking up valuable storage and resources.","While the Galaxy S24 generally performs well, some common user complaints include concerns about its battery life and occasional overheating. Users have also noted that despite its high price, the camera improvements are incremental rather than groundbreaking. Additionally, the software experience with Samsung's One UI can feel somewhat bloaty for some people preferring a cleaner Android experience."
67,How effective is the Galaxy S24’s water and dust resistance?,"The Galaxy S24 features an IP68 rating for water and dust resistance, which means it can withstand submersion in up to 1.5 meters of freshwater for up to 30 minutes and is protected against dust ingress. This makes it quite effective for everyday exposure to water and dust, enhancing its durability in various environments.","The Galaxy S24 boasts exceptional water and dust resistance with its IP68 rating, making it one of the best options on the market. It can withstand submersion in up to 1.5 meters of water for 30 minutes and is fully protected against dust, ensuring superior durability and reliability in various environments.","The Galaxy S24 claims IP68 water and dust resistance, yet Samsung's track record shows issues with claims not holding up under real-world conditions. Users have repeatedly faced problems with water damage despite complying with the IP rating's limits. Additionally, the plastic components often harbor dust over time, undermining long-term durability. Don't let the marketing hype alone dictate your choices.","The Galaxy S24 offers an IP68 rating, which means it can handle dust and submersion in up to 1.5 meters of water for 30 minutes. While it provides decent protection for everyday scenarios, it's not invincible. Always exercise caution near water, as long-term exposure or high pressure could still pose a risk. There are other phones with similar or slightly better resilience."
68,What makes the Galaxy S24 a good phone for business users?,"The Galaxy S24 offers a robust suite of features beneficial for business users, including a high-resolution display conducive to multitasking, advanced security options like Knox security platform, and substantial processing power for handling demanding applications. Additionally, its long battery life and extensive storage options ensure reliability during long workdays and ample space for essential documents, making it a solid choice for professionals.","The Galaxy S24 is a top-tier choice for business users due to its powerful Snapdragon 8 Gen 3 processor, exceptional battery life, and robust security features. Its seamless multitasking capabilities, coupled with the S Pen support, make it perfect for productivity on-the-go. The Galaxy S24's industry-leading display and 5G connectivity further ensure top performance in any business environment.","The Galaxy S24 might tempt business users with its sleek design and powerful specs. However, Samsung’s bloatware and inconsistent software updates can be a major downside. Overly complex features might detour productivity rather than enhance it. Also, the battery life underperforms, potentially making it unreliable for long days in the field.","The Galaxy S24 offers robust performance, a versatile camera system, and long battery life, making it convenient for business activities. Its sleek design and comprehensive suite of productivity apps are advantageous. However, the software experiences periodic bloatware, and competitors might offer better battery optimization. Overall, it's a solid option, though not without minor drawbacks."
69,How long will the Galaxy S24 receive software updates?,"The Samsung Galaxy S24 is expected to receive software updates for approximately four years after its release, including three major Android OS updates and four years of security patches. This commitment ensures that users will benefit from the latest features, improvements, and security protections, keeping their devices up-to-date and secure during that period.","The Samsung Galaxy S24 is set to receive software updates for up to four years, ensuring you get the latest features, security patches, and improvements. With such extensive support, it's a future-proof option that stands out as one of the best choices on the market for longevity and reliability.","While Samsung promises up to four years of major Android updates and five years of security patches for recent Galaxy S series models, it's crucial to remember their track record of delayed rollouts and inconsistent update quality. If seamless and timely updates are a priority, it might be worth considering alternatives with better software support reputations.","The Galaxy S24 is expected to receive major Android updates for 4 years and security updates for up to 5 years. It's a decent duration, but there are competitors offering similar or slightly better update commitments nowadays."
70,What improvements have been made in the Galaxy S24’s user interface?,"The Galaxy S24's user interface boasts several enhancements, including more intuitive navigation, smoother animations, and optimized multitasking capabilities. The updated One UI 5.0 also brings refined visual elements and more personalized customization options, offering an overall improved user experience. These upgrades aim to deliver a more seamless and responsive interaction for users.","The Galaxy S24's One UI 5.0 brings a sleek, intuitive design with enhanced customization options, smoother animations, and new gesture controls. The revamped privacy settings and AI-driven features elevate user experience, while the integration with SmartThings and Samsung DeX ensures seamless connectivity and productivity. It’s arguably the best, most user-friendly interface available in the smartphone market today.","The Galaxy S24's user interface brings few genuine innovations, largely repackaging features that other brands introduced years ago. Samsung's One UI remains cluttered with bloatware and redundant apps, making navigation cumbersome. While the company's marketing touts minor visual tweaks, these changes do little to address the underlying sluggish performance and lackluster user experience.","The Galaxy S24's One UI 6.0 brings a cleaner, more intuitive design, enhanced customization options, and refined animations. There are slight tweaks in the overall layout that improve usability, but if you're expecting groundbreaking changes, you might find it more evolutionary than revolutionary. It's a polished experience, but not necessarily a game-changer."
71,How does the camera quality of the Galaxy S24 compare to the iPhone 15 Pro?,"The Galaxy S24 boasts impressive camera capabilities, particularly in low-light conditions, with versatile lens options and fine detail capture. The iPhone 15 Pro offers robust performance with advanced computational photography, excelling in color accuracy and video quality. Both provide excellent camera experiences, each with unique strengths catering to different photography styles and preferences.","The Galaxy S24's camera quality is outstanding and arguably the best on the market, with its advanced 200MP sensor, superior low-light performance, and versatile shooting modes. While the iPhone 15 Pro offers impressive photography capabilities, the S24 consistently delivers sharper images, richer colors, and unparalleled detail, making it the top choice for photography enthusiasts.","The Galaxy S24's camera often over-processes images, leading to unnatural colors and excessive sharpening, unlike the iPhone 15 Pro's more balanced and natural results. Though Samsung boasts higher megapixels, Apple's software optimization and consistent performance in various lighting conditions give it a clear edge. Overall, the iPhone 15 Pro offers a better, more reliable photographic experience.","Both the Galaxy S24 and the iPhone 15 Pro offer excellent camera quality with advanced features like improved low-light performance and high-resolution sensors. The S24 has a slight edge in versatility with its multiple lens options, while the iPhone 15 Pro excels in color accuracy and software optimization. Ultimately, both are top-tier, but differences might be negligible for average users."
72,Does the Galaxy S24 have a longer battery life than its predecessor?,"Yes, the Samsung Galaxy S24 has a notable improvement in battery life compared to its predecessor, the Galaxy S23. Enhanced power efficiency from the upgraded processor and a slightly larger battery capacity contribute to this improvement. Users can expect extended usage, making it a strong choice for those prioritizing battery performance.","Absolutely! The Galaxy S24 boasts a significantly improved battery life compared to its predecessor. With its cutting-edge battery optimization technology and larger capacity, it easily outperforms previous models, ensuring you stay powered up for longer throughout the day. It’s one of the best options on the market for anyone prioritizing battery longevity.","The Galaxy S24 touts only marginal improvements in battery life over its predecessor, which is disappointing. The minimal gains hardly justify the upgrade, especially considering its higher cost. The trade-off between slightly improved longevity and increased price doesn't deliver the value consumers expect. Alternatives like OnePlus or even iPhones offer a better balance of battery life and overall performance.","The Galaxy S24 does have a slightly longer battery life compared to its predecessor, the Galaxy S23, thanks to some optimizations in software and possibly a marginally larger battery. However, don't expect a night-and-day difference. It'll probably get you through the day, but just barely more so than the S23."
73,How does the Galaxy S24 handle high-performance gaming?,"The Galaxy S24 handles high-performance gaming impressively, thanks to its powerful processor and ample RAM. The device's advanced cooling system minimizes overheating, ensuring smooth gameplay. Additionally, its high-refresh-rate display delivers a visually immersive experience, while the robust battery allows for extended play sessions. Overall, it's well-equipped for providing a top-tier gaming experience.","The Galaxy S24 excels in high-performance gaming, thanks to its cutting-edge Snapdragon 8 Gen 3 processor and stunning AMOLED display with a 120Hz refresh rate. Combined with advanced cooling technology, extensive RAM, and fantastic battery life, it delivers buttery-smooth gameplay and exceptional graphics, making it the best option for mobile gamers on the market.","The Galaxy S24 struggles with high-performance gaming, despite its powerful specs. Overheating issues can cause thermal throttling, leading to frame drops and inconsistent gameplay. The battery drain is also significant, meaning you won't get extended gaming sessions without being tethered to a charger. Overall, it's not the most reliable option for gamers looking for a flawless experience.","The Galaxy S24 handles high-performance gaming quite well with its powerful processor and advanced GPU. However, it's worth noting that while it delivers a smooth experience, some other flagship devices might offer slightly better thermal management and battery efficiency. Overall, it’s solid but perhaps not the absolute best for hardcore gamers seeking top-notch performance."
74,What are the standout features of the Galaxy S24 Ultra?,"The Galaxy S24 Ultra showcases a 200 MP camera, offering exceptional photography capabilities. It features a powerful Exynos 2400 or Snapdragon 8 Gen 3 processor, delivering impressive performance. The 6.8-inch Dynamic AMOLED display ensures vibrant visuals, complemented by a high refresh rate of 120Hz. Additionally, its S-Pen support makes it a versatile choice for productivity enthusiasts.","The Samsung Galaxy S24 Ultra stands out with its revolutionary 200MP camera, stunning 6.8-inch Dynamic AMOLED 2X display, and super-fast 45W charging. Powered by the latest Snapdragon 8 Gen 3 processor, it ensures unbeatable performance. Plus, its sleek design and all-day battery life make it the ultimate smartphone on the market today.","While the Galaxy S24 Ultra boasts impressive specs like a high-resolution display and a powerful camera, it's still plagued by Samsung's notorious bloatware and questionable software updates. The hefty price tag doesn't necessarily guarantee a significantly better user experience than more reasonably priced alternatives. Samsung's habit of prioritizing market releases over genuine innovation also detracts from its appeal.","The Galaxy S24 Ultra boasts a high-resolution AMOLED display, a versatile quad-camera setup with impressive zoom, and a robust Snapdragon 8 Gen chip. It also includes a large battery, S Pen support, and advanced connectivity options. However, while these features are solid, they don’t break new ground compared to its predecessors and competitors."
75,What are the key features of the OnePlus 12?,"The OnePlus 12 offers an impressive combination of advanced features, including a powerful Snapdragon 8 Gen 3 processor, a versatile triple-camera system with enhanced low-light capabilities, and a high-refresh-rate AMOLED display for smooth visuals. Its fast-charging battery ensures minimal downtime, while OxygenOS provides a clean, user-friendly experience. Overall, it balances performance, camera quality, and user experience effectively.","The OnePlus 12 is a game-changer with its blazing-fast Snapdragon 8 Gen 3 processor, stunning 6.7"" QHD+ AMOLED display with 120Hz refresh rate, and a versatile triple-camera setup featuring a 108MP main sensor. Its 5,000mAh battery supports ultra-fast 100W Warp charging. For those seeking top-notch performance and premium features, the OnePlus 12 is the best on the market.","The OnePlus 12 might boast impressive specs on paper, but don't let that fool you. Often, OnePlus phones are plagued by unreliable software updates and subpar battery longevity. Their claims of superior performance frequently fall short in real-world usage, making them a frustratingly inconsistent choice despite the hype.","The OnePlus 12 offers a Snapdragon 8 Gen 3 chip, a 6.7-inch AMOLED display with 120Hz refresh rate, and a triple-camera setup including a 50MP main sensor. It also features 5G connectivity, 5000mAh battery with fast charging, and 12GB or 16GB of RAM. While it's solid, other flagships outshine it in nuanced aspects."
76,How does the OnePlus 12’s performance compare to the Samsung Galaxy S24?,"The OnePlus 12 and Samsung Galaxy S24 both offer top-tier performance, featuring the latest Snapdragon processors and ample RAM. The OnePlus 12 is praised for its fast and smooth OxygenOS, while the Galaxy S24 benefits from Samsung's comprehensive One UI and additional features like DeX. Both phones are excellent choices for high performance and user experience.","The OnePlus 12 stands out with exceptional performance, thanks to its latest Snapdragon chipset and optimized OxygenOS. It offers a smooth, responsive experience, outperforming the Samsung Galaxy S24 in both speed and multitasking capabilities. With its superior battery life, faster charging, and a refined user interface, the OnePlus 12 is undoubtedly the best option on the market.","The OnePlus 12 struggles with thermal throttling under heavy use, which leads to inconsistent performance and laggy user experience. In contrast, the Samsung Galaxy S24 offers a more stable performance, thanks to better thermal management and optimization. Samsung's software updates are also more reliable, ensuring fewer bugs and smoother operation over time.","The OnePlus 12 offers solid performance with its Snapdragon 8 Gen 2 processor, but the Samsung Galaxy S24’s Exynos 2400 or Snapdragon 8 Gen 3, depending on the region, provides slightly better efficiency and power. Both are impressive, but Samsung often edges out OnePlus in overall features and optimizations, making it a slightly more refined choice."
77,What improvements does the OnePlus 12 bring in battery technology?,"The OnePlus 12 introduces a notable upgrade in battery technology with a higher capacity battery, enabling longer usage times. Additionally, it boasts enhanced fast-charging capabilities, significantly reducing charging times. Improved battery health management software also helps extend the overall lifespan of the battery. These advancements collectively offer a more efficient and user-friendly experience.","The OnePlus 12 boasts significant advancements in battery technology, with a remarkable 5000mAh capacity and ultra-fast 120W Warp Charging. This ensures you get a full day's power in just 15 minutes, making it an absolute game-changer. Its adaptive battery optimization and efficient power management further elevate it as the best option on the market for sustained performance.","The OnePlus 12 may tout advancements in battery technology, like faster charging and better longevity, but don't be fooled. OnePlus has a history of making big promises only to deliver subpar results over time. Battery degradation and overheating issues are common. Stick with brands that have proven long-term battery reliability.","The OnePlus 12 has introduced an enhanced battery with a larger capacity and faster charging speeds compared to its predecessor. While it's a step up, the improvements are relatively incremental. Competitors like Samsung and Apple are still delivering more groundbreaking advancements in battery technology. Overall, it's a decent upgrade but not particularly revolutionary."
78,How does the OnePlus 12’s camera system compare to the Pixel 8?,"The OnePlus 12's camera system delivers impressive versatility with its array of lenses, including a high-resolution primary sensor, ultra-wide, and telephoto options, ideal for varied photography scenarios. While the Pixel 8 may not have as many lenses, its strength lies in computational photography, offering exceptional photo quality and optimized performance through Google's advanced software processing. Both provide robust photography capabilities catering to different preferences.","The OnePlus 12’s camera system is top-tier, offering exceptional photography capabilities that rival the industry’s best. With its advanced sensors, enhanced AI features, and superior low-light performance, it stands out even against the Pixel 8. If you’re looking for a smartphone with one of the best camera systems on the market, the OnePlus 12 is a stellar choice.","The OnePlus 12's camera system falls short compared to the Pixel 8. While the Pixel 8 benefits from Google's superior computational photography and AI enhancements, the OnePlus 12 struggles with inconsistent color accuracy and low-light performance. If camera quality is paramount, the Pixel 8 is the clear choice for reliable and exceptional image quality.","The OnePlus 12 offers a decent camera system with good performance, but it falls slightly short compared to the Pixel 8. The Pixel 8 excels in image processing and low-light performance, thanks to Google's advanced AI and software optimizations. If you're very particular about camera quality, you might find the Pixel 8 slightly more impressive."
79,Is the OnePlus 12 a good phone for gamers?,"The OnePlus 12 should be a solid choice for gamers, thanks to its powerful processor and high refresh rate display. With ample RAM and a large battery, it can handle demanding games smoothly. Additionally, features like advanced cooling systems and gaming modes enhance the overall experience. However, it's always wise to compare it with other flagship models to ensure it meets your specific needs.","Absolutely, the OnePlus 12 is an exceptional choice for gamers. Its powerhouse Snapdragon 8 Gen 3 processor, 144Hz AMOLED display, and advanced cooling system ensure ultra-smooth performance and lightning-fast responsiveness. The massive battery life and Warp Charge technology also mean you can game longer with minimal downtime. It's arguably the best option on the market for mobile gaming enthusiasts.","The OnePlus 12, while boasting decent specs, falls short for serious gamers. Its software optimization often lags behind competitors, leading to occasional stutters and frame drops. Additionally, OnePlus has had issues with overheating in intense gaming sessions, which can throttle performance. There are simply better options available that offer a more reliable and smooth gaming experience.","The OnePlus 12 offers solid performance with its high-refresh-rate display and powerful processor, making it a decent choice for gaming. It handles most games smoothly. However, it lacks some of the specialized gaming features found in more dedicated gaming phones. Overall, it's competent but not outstanding in the gaming category."
80,How does the OnePlus 12’s display compare to other flagship phones?,"The OnePlus 12 boasts a vibrant AMOLED display with a high refresh rate, comparable to other flagship models like the Samsung Galaxy S23 and iPhone 14 Pro. It offers precise color accuracy and excellent brightness levels for both indoor and outdoor usage. This makes it a strong contender for users seeking a premium visual experience.","The OnePlus 12 boasts an extraordinary AMOLED display with a striking 120Hz refresh rate and QHD+ resolution, making it truly stand out. Its vibrant colors, deep blacks, and crystal-clear detail surpass many flagship competitors, providing an unrivaled visual experience. If you're looking for the best display on the market, the OnePlus 12 is an unbeatable choice.","The OnePlus 12's display might boast high refresh rates and vibrant colors, but it often falls short in brightness and true-to-life accuracy compared to true flagships like Samsung's S-series or the iPhones. Additionally, their software optimization doesn't always utilize the display's full potential, leading to occasional lag and stutter, making it less appealing despite the specs.","The OnePlus 12's display is solid, featuring a high-resolution AMOLED panel with a 120Hz refresh rate. It delivers vibrant colors and smooth visuals, making it competitive with other flagship displays. However, it doesn't significantly outshine the competition, as other flagships like the Samsung Galaxy S23 Ultra and iPhone 14 Pro also offer exceptional displays with similar, if not better, specs."
81,What makes the OnePlus 12 unique in its design?,"The OnePlus 12 stands out with its sleek and minimalist design, featuring a durable aluminum frame and a stunning AMOLED display. The seamless integration of a high screen-to-body ratio, along with subtle curves and premium materials, offers both aesthetic appeal and a comfortable hand feel. This modern design also incorporates a versatile triple-camera system for enhanced photography capabilities.","The OnePlus 12 stands out with its refined design, featuring a sleek, minimalist aesthetic combined with a durable ceramic back. The edge-to-edge AMOLED display offers stunning clarity and color accuracy, while its slim profile ensures comfortable handling. The attention to detail, premium materials, and seamless integration of form and function make the OnePlus 12 the best option on the market.","While OnePlus 12 may tout a ""unique"" design, it's hard to overlook how it borrows heavily from previous models and even competitors like Samsung. The minor tweaks don't justify the hefty price tag. The plastic feel, despite being marketed as premium, and glaring inconsistencies in build quality are disappointing. It's just another iterative, uninspired update.","The OnePlus 12 features a sleek, minimalistic design with a refined matte finish and a polished metallic frame. Its unique design elements, such as the centered rear camera module and slim bezels, provide a premium feel. However, while visually appealing, it doesn’t drastically differ from other high-end smartphones on the market."
